{
  "schema_version": 1,
  "registry_id": "MADCAT-RECEIPT-SIGNERS-1",
  "repository": "masait78-wq/-madcat-telegram-bridge.",
  "algorithm": "Ed25519",
  "keys": [],
  "truth_boundary": "Receipt acceptance is disabled and no production signer key is provisioned. A future key alone cannot activate the bus: all four activation gates in config/acceptance-policy.json must be proved by a separately reviewed change. A valid signature proves possession of that key, not identity, authority, external execution, replay safety, or correctness of the signed claim."
}
